{
  "$schema": "https://json-schema.org/draft/2020-12/schema",
  "$id": "https://github.com/HUBTECH-DEV/hubtech-intent-context-governance-framework/raw/main/schemas/prompt-history.schema.json",
  "title": "HubICG chat audit record",
  "type": "object",
  "required": [
    "chatName",
    "createdAt",
    "lastUpdated",
    "messages"
  ],
  "properties": {
    "chatName": {
      "type": "string",
      "minLength": 1
    },
    "createdAt": {
      "type": "string",
      "format": "date-time"
    },
    "lastUpdated": {
      "type": "string",
      "format": "date-time"
    },
    "messages": {
      "type": "array",
      "items": {
        "type": "object",
        "required": [
          "timestamp",
          "role",
          "content"
        ],
        "properties": {
          "timestamp": {
            "type": "string",
            "format": "date-time"
          },
          "role": {
            "type": "string",
            "enum": [
              "system",
              "developer",
              "user",
              "assistant",
              "tool"
            ]
          },
          "content": {
            "type": "string"
          }
        },
        "additionalProperties": true
      }
    },
    "metadata": {
      "type": "object"
    }
  },
  "additionalProperties": false
}
